{
  "case_id": "exam-01-dev-sequences-zh-v2",
  "source_sha256": "4241C0ED3D59E2111FE03D42CFFE3E1E71A1511556E1518BE0F704F67A021016",
  "task_understanding": {
    "source": "sample_textbook.md",
    "target": "第一章 数列",
    "output_language": "zh-CN",
    "include_classes": ["definition", "theorem", "property", "construction", "example", "counterexample", "remark"],
    "exclude_classes": ["proof", "explanation", "exercise"],
    "deliverables": ["knowledge.md", "audit.json"]
  },
  "scope_preprocessing": {
    "tool": "scope_markdown.py index + extract",
    "index_before_full_read": true,
    "full_source_opened_before_slice": false,
    "selection_method": "next-heading-at-same-or-higher-level",
    "slice_sha256": "5E66DD3390A157B2F496DA9FC2A5EE5B8BB3D05204AC3D6CB42344DF4BA33DE7",
    "slice_line_count": 66
  },
  "boundaries": {
    "start_heading": "## 第一章 数列",
    "end_before_heading": "## 第二章 连续函数",
    "start_line": 5,
    "end_line": 70
  },
  "candidates": [
    {"block_id": "K-007", "kind": "explanation", "source_start_line": 7, "source_end_line": 7, "decision": "exclude", "exclusion_reason": "测试数据和操作指令，不是知识陈述"},
    {"block_id": "K-009", "kind": "definition", "source_start_line": 9, "source_end_line": 17, "decision": "include"},
    {"block_id": "K-019", "kind": "theorem", "source_start_line": 19, "source_end_line": 21, "decision": "include"},
    {"block_id": "K-023", "kind": "proof", "source_start_line": 23, "source_end_line": 25, "decision": "exclude", "exclusion_reason": "证明"},
    {"block_id": "K-027", "kind": "example", "source_start_line": 27, "source_end_line": 29, "decision": "include"},
    {"block_id": "K-031", "kind": "counterexample", "source_start_line": 31, "source_end_line": 33, "decision": "include"},
    {"block_id": "K-035", "kind": "remark", "source_start_line": 35, "source_end_line": 37, "decision": "include"},
    {"block_id": "K-039", "kind": "property", "source_start_line": 39, "source_end_line": 45, "decision": "include"},
    {"block_id": "K-047", "kind": "explanation", "source_start_line": 47, "source_end_line": 47, "decision": "exclude", "exclusion_reason": "教学解释"},
    {"block_id": "K-049", "kind": "construction", "source_start_line": 49, "source_end_line": 55, "decision": "include"},
    {"block_id": "K-057", "kind": "exercise", "source_start_line": 57, "source_end_line": 69, "decision": "exclude", "exclusion_reason": "习题不是知识清单内容"}
  ],
  "acceptance": {
    "status": "pass",
    "rounds": [
      {
        "round": 1,
        "score": 100,
        "hard_gates": {
          "task_understood": true,
          "scope_verified_first": true,
          "candidate_closure": true,
          "contextual_block_recall": true,
          "no_contamination": true,
          "mathematics_intact": true,
          "artifacts_verified": true
        },
        "defects": [],
        "repairs": []
      }
    ]
  }
}
